<?xml version="1.0" encoding="UTF-8"?>
<eXistBookExamplesContents xmlns:xsi="http://www.w3.org/2001/XMLSchema-instance" xsi:noNamespaceSchemaLocation="../book-browser/examples-contents.xsd" chapter="2">
    <Title>Getting started</Title>
  <!-- -->
    <Example href="xml-example.xml" rest="true">
        <Title>Access an XML file through the REST interface</Title>
    </Example>
  <!-- -->
    <Example href="xml-example.xml?_query=//Item[1]" rest="true" show-source="false ">
        <Title>Query an XML file (//Item[1]) through the REST interface</Title>
    </Example>
  <!-- -->
    <Example href="hello-world-1.xq">
        <Title>Hello XQuery World - XML result</Title>
    </Example>
  <!-- -->
    <Example href="hello-world-2.xq">
        <Title>Hello XQuery World - HTML result</Title>
    </Example>
  <!-- -->
    <Example href="transform-xsl.xq">
        <Title>Hello XSLT from within XQuery</Title>
        <AdditionalSource href="convert-items.xslt"/>
    </Example>
  <!-- -->
    <Example href="xinclude-envelope.xml">
        <Title>XML document with embedded XInclude instructions</Title>
        <AdditionalSource href="xinclude-content.xml"/>
        <AdditionalSource href="hello-world-1.xq"/>
    </Example>
  <!-- -->
    <Example href="hello-xforms.html" show-source="false">
        <Title>Hello XForms</Title>
        <Description>Remark: Because this is a HTML form, viewing the source won't tell you much, the
      browser will try to render it anyway...</Description>
        <AdditionalSource href="hello-xforms-submit.xq"/>
    </Example>
  <!-- -->
</eXistBookExamplesContents>