<?xml version="1.0" encoding="UTF-8"?>
<eXistBookExamplesContents xmlns:xsi="http://www.w3.org/2001/XMLSchema-instance"
  xsi:noNamespaceSchemaLocation="../book-browser/examples-contents.xsd" chapter="10">
  <Title>Basic and Text Indexing</Title>
  <!-- -->
  <Example href="test-indexes.xq">
    <Title>Test searches with and without indexes</Title>
    <AdditionalSource href="data/Encyclopedia.xml"/>
    <AdditionalSource href="data/Encyclopedia-ALT.xml"/>
    <AdditionalSource href="collection.xconf"/>
  </Example>
  <!-- -->
  <!-- - - - - - - - - - - - - - - - - - - - - - - - - - - - - - - - -->
  <!-- -->
  <Example href="search-demo.xq">
    <Title>Full-text search</Title>
    <AdditionalSource href="search-demo-result.xq"/>
    <AdditionalSource href="data/Encyclopedia.xml"/>
    <AdditionalSource href="collection.xconf"/>
  </Example>
  <!-- -->
</eXistBookExamplesContents>