<?xml version="1.0" encoding="UTF-8"?>
<eXistBookExamplesContents xmlns:xsi="http://www.w3.org/2001/XMLSchema-instance" xsi:noNamespaceSchemaLocation="../book-browser/examples-contents.xsd" chapter="8">
    <Title>Building Applications</Title>
  <!-- -->
    <Example href="mini-application/" show-source="false">
        <Title>The URL rewriting demo mini application</Title>
        <AdditionalSource href="mini-application/controller.xql"/>
        <AdditionalSource href="mini-application/home.xql"/>
        <AdditionalSource href="mini-application/hello.xql"/>
    </Example>
  <!-- -->
    <Example href="show-controller-variables/" show-source="false">
        <Title>Show the controller variables</Title>
        <AdditionalSource href="show-controller-variables/controller.xql"/>
        <AdditionalSource href="show-controller-variables/show-controller-variables.xql"/>
    </Example>
  <!-- -->
    <Example href="views/" show-source="false">
        <Title>Examples for the advanced URL controlling</Title>
        <AdditionalSource href="views/controller.xql"/>
        <AdditionalSource href="views/createmodel.xql"/>
        <AdditionalSource href="views/home.xql"/>
        <AdditionalSource href="views/xsl/view1.xsl"/>
        <AdditionalSource href="views/xsl/view2a.xsl"/>
        <AdditionalSource href="views/xsl/view2b.xsl"/>
    </Example>
  <!-- -->
    <Example href="upload/upload.xql">
        <Title>Upload a file to the database</Title>
        <Description>The file will be stored in /db/apps/eXist-book/data</Description>
        <AdditionalSource href="upload/upload-process.xql"/>
    </Example>
  <!-- -->
    <Example href="download.xql">
        <Title>Download an XML file</Title>
    </Example>
  <!-- -->
</eXistBookExamplesContents>